<?xml version="1.0" encoding="UTF-8" standalone="yes"?>
<game xmlns:xsi="http://www.w3.org/2001/XMLSchema-instance"
      min_players="2"
      max_players="4"
      name="dominion"
      xsi:noNamespaceSchemaLocation="game.xsd">
    <pieces>
        <piece id="card_copper">
            <attribute name="value">1</attribute>
            <attribute name="cost">0</attribute>
            <attribute name="base">true</attribute>
            <attribute name="treasure">true</attribute>
        </piece>
        <piece id="card_silver">
            <attribute name="value">2</attribute>
            <attribute name="cost">3</attribute>
            <attribute name="base">true</attribute>
            <attribute name="treasure">true</attribute>
        </piece>
        <piece id="card_gold">
            <attribute name="value">3</attribute>
            <attribute name="cost">6</attribute>
            <attribute name="base">true</attribute>
            <attribute name="treasure">true</attribute>
        </piece>
        <piece id="card_curse">
            <attribute name="value">0</attribute>
            <attribute name="cost">0</attribute>
            <attribute name="points">-1</attribute>
            <attribute name="base">true</attribute>
        </piece>
        <piece id="card_estate">
            <attribute name="value">0</attribute>
            <attribute name="cost">2</attribute>
            <attribute name="points">1</attribute>
            <attribute name="base">true</attribute>
            <attribute name="victory">true</attribute>
        </piece>
        <piece id="card_duchy">
            <attribute name="value">0</attribute>
            <attribute name="cost">5</attribute>
            <attribute name="points">3</attribute>
            <attribute name="base">true</attribute>
            <attribute name="victory">true</attribute>
        </piece>
        <piece id="card_province">
            <attribute name="value">0</attribute>
            <attribute name="cost">8</attribute>
            <attribute name="points">6</attribute>
            <attribute name="base">true</attribute>
            <attribute name="victory">true</attribute>
        </piece>
        <piece id="card_gardens">
            <attribute name="value">0</attribute>
            <attribute name="cost">4</attribute>
            <attribute name="points">garden</attribute>
            <attribute name="victory">true</attribute>
        </piece>
        <piece id="card_cellar">
            <attribute name="value">0</attribute>
            <attribute name="cost">2</attribute>
            <relation name="action" to="action_card_cellar"/>
        </piece>
        <piece id="card_chapel">
            <attribute name="value">0</attribute>
            <attribute name="cost">2</attribute>
            <relation name="action" to="action_card_chapel"/>
        </piece>
        <piece id="card_moat">
            <attribute name="value">0</attribute>
            <attribute name="cost">2</attribute>
            <relation name="action" to="action_card_moat"/>
            <relation name="reaction" to="reaction_card_moat"/>
        </piece>
        <piece id="card_chancellor">
            <attribute name="value">0</attribute>
            <attribute name="cost">3</attribute>
            <relation name="action" to="action_card_chancellor"/>
        </piece>
        <piece id="card_village">
            <attribute name="value">0</attribute>
            <attribute name="cost">3</attribute>
            <relation name="action" to="action_card_village"/>
        </piece>
        <piece id="card_woodcutter">
            <attribute name="value">0</attribute>
            <attribute name="cost">3</attribute>
            <relation name="action" to="action_card_woodcutter"/>
        </piece>
        <piece id="card_workshop">
            <attribute name="value">0</attribute>
            <attribute name="cost">3</attribute>
            <relation name="action" to="action_card_workshop"/>
        </piece>
        <piece id="card_bureaucrat">
            <attribute name="value">0</attribute>
            <attribute name="cost">4</attribute>
            <attribute name="attack">true</attribute>
            <relation name="action" to="action_card_bureaucrat"/>
        </piece>
        <piece id="card_feast">
            <attribute name="value">0</attribute>
            <attribute name="cost">4</attribute>
            <relation name="action" to="action_card_feast"/>
        </piece>
        <piece id="card_militia">
            <attribute name="value">0</attribute>
            <attribute name="cost">4</attribute>
            <attribute name="attack">true</attribute>
            <relation name="action" to="action_card_militia"/>
        </piece>
        <piece id="card_moneylender">
            <attribute name="value">0</attribute>
            <attribute name="cost">4</attribute>
            <relation name="action" to="action_card_moneylender"/>
        </piece>
        <piece id="card_remodel">
            <attribute name="value">0</attribute>
            <attribute name="cost">4</attribute>
            <relation name="action" to="action_card_remodel"/>
        </piece>
        <piece id="card_smithy">
            <attribute name="value">0</attribute>
            <attribute name="cost">4</attribute>
            <relation name="action" to="action_card_smithy"/>
        </piece>
        <piece id="card_spy">
            <attribute name="value">0</attribute>
            <attribute name="cost">4</attribute>
            <relation name="action" to="action_card_spy"/>
        </piece>
        <piece id="card_thief">
            <attribute name="value">0</attribute>
            <attribute name="cost">4</attribute>
            <relation name="action" to="action_card_thief"/>
        </piece>
        <piece id="card_throne_room">
            <attribute name="value">0</attribute>
            <attribute name="cost">4</attribute>
            <relation name="action" to="action_card_throne_room"/>
        </piece>
        <piece id="card_council_room">
            <attribute name="value">0</attribute>
            <attribute name="cost">5</attribute>
            <relation name="action" to="action_card_council_room"/>
        </piece>
        <piece id="card_festival">
            <attribute name="value">0</attribute>
            <attribute name="cost">5</attribute>
            <relation name="action" to="action_card_festival"/>
        </piece>
        <piece id="card_laboratory">
            <attribute name="value">0</attribute>
            <attribute name="cost">5</attribute>
            <relation name="action" to="action_card_laboratory"/>
        </piece>
        <piece id="card_library">
            <attribute name="value">0</attribute>
            <attribute name="cost">5</attribute>
            <relation name="action" to="action_card_library"/>
        </piece>
        <piece id="card_market">
            <attribute name="value">0</attribute>
            <attribute name="cost">5</attribute>
            <relation name="action" to="action_card_market"/>
        </piece>
        <piece id="card_mine">
            <attribute name="value">0</attribute>
            <attribute name="cost">5</attribute>
            <relation name="action" to="action_card_mine"/>
        </piece>
        <piece id="card_witch">
            <attribute name="value">0</attribute>
            <attribute name="cost">5</attribute>
            <relation name="action" to="action_card_witch"/>
        </piece>
        <piece id="card_adventurer">
            <attribute name="value">0</attribute>
            <attribute name="cost">6</attribute>
            <relation name="action" to="action_card_adventurer"/>
        </piece>
    </pieces>
    <turns>
        <turn id="start_turn" initial="true" action="action_start"/>
        <turn id="game_loop" action="action_game_loop"/>
        <turn id="council_room" action="action_council_room"/>
        <turn id="reaction" action="action_reaction"/>
        <turn id="bureaucrat_attack" action="action_bureaucrat_attack"/>
        <turn id="militia_attack" action="action_militia_attack"/>
        <turn id="spy_attack" action="action_spy_attack"/>
        <turn id="thief_attack" action="action_thief_attack"/>
        <turn id="witch_attack" action="action_witch_attack"/>
        <turn id="clean_up" action="action_clean_up" />
    </turns>
    <actions>
        <action id="play_card">
            <player-select from="player:hand:pieces[@action]" max="1" label="selectedCard" />
            <if exists="$selectedCard">
                <true>
                    <assign-attribute attribute="current_turn@actions" value="current_turn@actions - 1"/>
                    <move-pieces pieces="$selectedCard" to="player:played" />
                    <perform action="$selectedCard@action"/>
                    <if test="current_turn@actions > 0">
                        <true>
                            <perform action="action::play_card" />
                        </true>
                    </if>
                </true>
            </if>
        </action>
        <action id="buy_card">
            <select from="current_turn@treasure" label="max_cost" />
            <remove label="purchased" />
            <perform action="action::card_from_reserve" />
            <if exists="$purchased">
                <true>
                    <assign-attribute attribute="current_turn@buys" value="current_turn@buys - 1" />
                    <assign-attribute attribute="current_turn@treasure" value="current_turn@treasure - first(player:discard:pieces)@cost" />
                    <if test="current_turn@buys > 0">
                        <true>
                            <perform action="action::buy_card" />
                        </true>
                    </if>
                </true>
            </if>
        </action>
        <action id="action_find_treasure">